{
  "format": "model-checks/1.0",
  "checked_at": "2026-10-13T07:35:28+00:00",
  "summary": {
    "models_total": 32,
    "changed": 0,
    "with_errors": 0,
    "no_sources": 0
  },
  "models": [
    {
      "model": "Soul 2.0",
      "platform": "Higgsfield",
      "type": "image",
      "last_checked": "2026-10-13T07:29:39+00:00",
      "changed": false,
      "baseline": false,
      "source_status": "ok",
      "source_results": [
        {
          "url": "https://higgsfield.ai/",
          "ok": true,
          "http_status": 200,
          "signature": "73b48e0feee890ddb0486b445fdd0fcef763087e76843f6fd4d6c0a00cf9040c",
          "chars": 3263,
          "error": null,
          "excluded_from_signature": true
        },
        {
          "url": "https://github.com/osidemedia/higgsfield-ai-prompt-skill/blob/HEAD/skills/higgsfield-models/SKILL.md",
          "ok": true,
          "http_status": 200,
          "signature": "882bc40d2d5ea139254462ce7239f8735989941577ca34b0c9569d9e2572fa00",
          "chars": 85780,
          "error": null,
          "excluded_from_signature": true
        }
      ],
      "signal_excerpt": "Higgsfield AI — AI-native creative suite Higgsfield Explore Image Video Audio MCP API New Genjutsu top Katana New AI Influencer New ChatGPT Plugin ChatGPT Plugin Ads Studio New Effects Cinema Studio Contests Contests Marketing Studio Supercomputer 3D Jutsu New Edit Academy Community Plugins Canvas Originals Pricing Enterprise Login Sign up Open Genjutsu API Open Genjutsu API Your browser does not ",
      "signals": [
        {
          "name": "version_signal",
          "matches": [
            "3.0 Turbo",
            "2.5 Turbo",
            "3.0 Prime",
            "1.5 Pro",
            "3.1 Lite"
          ]
        }
      ],
      "news_status": "ok",
      "news_headlines": [
        {
          "title": "What Is Higgsfield AI? Uses, Features &amp; Pricing The Hype Magazine: Unveiling the Pulse of Urban Culture - From Hip Hop to Hollywood! Explore a Diverse Tapestry of Stories, Interviews, and Impactful Editorials Spanning Fashion, Gaming, Movies, MMA, EDM - The Hype Magazine",
          "date": "Sat, 10 Oct 2026 14:18:41 GMT"
        },
        {
          "title": "Higgsfield's valuation soars fourfold to $5.4 billion in six months on AI content demand - Reuters",
          "date": "Mon, 17 Aug 2026 07:00:00 GMT"
        },
        {
          "title": "Higgsfield raises $400M at $5.4 billion valuation to scale video and image generation platform - SiliconANGLE",
          "date": "Mon, 17 Aug 2026 07:00:00 GMT"
        },
        {
          "title": "higgsfield brings art-directed quality to AI image generation at production scale - Designboom",
          "date": "Fri, 03 Apr 2026 07:00:00 GMT"
        },
        {
          "title": "Higgsfield at $5.4 Billion: What the AI Platform Can Do and How Much Video Generation Costs - Incrypted",
          "date": "Wed, 30 Sep 2026 11:30:45 GMT"
        },
        {
          "title": "Higgsfield AI Review: I Made AI Films on a Budget Laptop - Unite.AI",
          "date": "Mon, 27 Apr 2026 07:00:00 GMT"
        },
        {
          "title": "How Higgsfield Scales Professional Video With NVIDIA AI - NVIDIA",
          "date": "Thu, 30 Apr 2026 18:44:03 GMT"
        },
        {
          "title": "Higgsfield AI Review: Hype, Gimmick, or a Creator’s Secret Weapon? - MobileAppDaily",
          "date": "Thu, 28 May 2026 11:34:41 GMT"
        }
      ],
      "note": "Higgsfield landing page is marketing copy; signals are noisy. Treat changed=true as 'page changed', not 'model changed'."
    },
    {
      "model": "Soul Cinema",
      "platform": "Higgsfield",
      "type": "image",
      "last_checked": "2026-10-13T07:29:44+00:00",
      "changed": false,
      "baseline": false,
      "source_status": "ok",
      "source_results": [
        {
          "url": "https://aiforautomation.io/news/2026-03-31-higgsfield-soul-cinema-preview-one-click-cinematic-ai",
          "ok": true,
          "http_status": 200,
          "signature": "4f79c2aad400dd6205d4d35ddfcf1f6872da696e0870f038759c18f13bb8f147",
          "chars": 8368,
          "error": null
        },
        {
          "url": "https://github.com/dsm5e/aso-tracker/blob/HEAD/aso-video/docs/higgsfield-prompts/skills/higgsfield-soul/SKILL.md",
          "ok": true,
          "http_status": 200,
          "signature": "4bae3f9d6b67dc67c18d9fd8ed286f201bc038c5ff2b41fae2402a3132761b5b",
          "chars": 88986,
          "error": null,
          "excluded_from_signature": true
        },
        {
          "url": "https://higgsfield.ai/blog/higgsfield-api",
          "ok": true,
          "http_status": 200,
          "signature": "e5e8d2d5ba6b2b36687d10c2f0b019ef8dda24eee40c26214e1f1865acf8edb6",
          "chars": 62719,
          "error": null,
          "excluded_from_signature": true
        }
      ],
      "signal_excerpt": "Higgsfield Soul Cinema Preview: Cinema AI in One Click | AI for Automation AI for Automation Learn AI News Business Cases Tools Setup Back to AI News 2026-03-31 Higgsfield AI video generator cinema AI character consistency AI AI image generation AI automation tools generative AI for film Soul Cinema Preview Higgsfield Soul Cinema Preview: Cinema AI in One Click Higgsfield Soul Cinema Preview deliv",
      "signals": [
        {
          "name": "price_signal",
          "matches": [
            "$10",
            "$120/mo",
            "$20/mo",
            "$500",
            "$0.00"
          ]
        },
        {
          "name": "version_signal",
          "matches": [
            "2.5 Pro"
          ]
        }
      ],
      "news_status": "ok",
      "news_headlines": [
        {
          "title": "What Is Higgsfield AI? Uses, Features &amp; Pricing The Hype Magazine: Unveiling the Pulse of Urban Culture - From Hip Hop to Hollywood! Explore a Diverse Tapestry of Stories, Interviews, and Impactful Editorials Spanning Fashion, Gaming, Movies, MMA, EDM - The Hype Magazine",
          "date": "Sat, 10 Oct 2026 14:18:41 GMT"
        },
        {
          "title": "Higgsfield AI Review: I Made AI Films on a Budget Laptop - Unite.AI",
          "date": "Mon, 27 Apr 2026 07:00:00 GMT"
        },
        {
          "title": "Meet Hell Grind, The First Feature Film \"Created Entirely On The Higgsfield AI Platform\" - CGMagazine",
          "date": "Tue, 19 May 2026 07:00:00 GMT"
        },
        {
          "title": "Higgsfield launches crowdsourced AI TV pilot where influencers are AI film stars - GamesBeat",
          "date": "Tue, 07 Apr 2026 07:00:00 GMT"
        },
        {
          "title": "Trailer Launched For History-Making AI Feature Film, Hell Grind - SciFiNow",
          "date": "Thu, 21 May 2026 07:00:00 GMT"
        },
        {
          "title": "Artificial intelligence shot a full-length movie in two weeks - hi-Tech.ua",
          "date": "Thu, 28 May 2026 07:00:00 GMT"
        },
        {
          "title": "Higgsfield Launches Industry-First Crowdsourced AI TV Pilot Where Influencers Become AI Film Stars - TNGlobal",
          "date": "Fri, 10 Apr 2026 07:00:00 GMT"
        },
        {
          "title": "AI makes a feature film in 14 days: Higgsfield shares its $500,000 filmmaking process with creators - CNBC TV18",
          "date": "Wed, 05 Aug 2026 07:00:00 GMT"
        }
      ],
      "note": "Watchtower 2.4 calibration (2026-10-12): Higgsfield's API post — the page carrying Soul Cinema's $0.0032/image rate — is signature-unstable by proof: two consecutive fetches with the checker's fetch path returned two different signatures at identical length (63,349 chars); the page embeds a rotating prompt-library payload. Excluded from the signature (the same treatment Marketing Studio already has for this URL), still fetched and recorded every run, and its rate table is read at every review pass."
    },
    {
      "model": "Soul Cast",
      "platform": "Higgsfield",
      "type": "image",
      "last_checked": "2026-10-13T07:29:50+00:00",
      "changed": false,
      "baseline": false,
      "source_status": "ok",
      "source_results": [
        {
          "url": "https://github.com/steven-3352/case-study/blob/HEAD/.agents/skills/higgsfield-soul/SKILL.md",
          "ok": true,
          "http_status": 200,
          "signature": "062ef76fff96951223218d7805651a594d94e4ecb3bb0ccc2fdddc5df1c35f35",
          "chars": 89877,
          "error": null,
          "excluded_from_signature": true
        },
        {
          "url": "https://higgsfield.ai/",
          "ok": true,
          "http_status": 200,
          "signature": "cb725a764a1653827bc3bb2138245e12fef5b468b5c667b5098a4b4998500705",
          "chars": 3241,
          "error": null,
          "excluded_from_signature": true
        }
      ],
      "signal_excerpt": "case-study/.agents/skills/higgsfield-soul/SKILL.md at 5ec97b0e3f2a9103b772b977180ed268294b7492 · steven-3352/case-study · GitHub Skip to content Navigation Menu Sign in Appearance settings Platform AI CODE CREATION GitHub Copilot Write better code with AI GitHub Copilot app Direct agents from issue to merge MCP Registry Integrate external tools DEVELOPER WORKFLOWS Actions Automate any workflow Cod",
      "signals": [
        {
          "name": "price_signal",
          "matches": [
            "$10",
            "$500"
          ]
        }
      ],
      "news_status": "ok",
      "news_headlines": [
        {
          "title": "Meet Hell Grind, The First Feature Film “Created Entirely On The Higgsfield AI Platform” - Yahoo",
          "date": "Tue, 19 May 2026 07:00:00 GMT"
        },
        {
          "title": "Higgsfield Launches AI Content-Scoring Tool to Tackle Likeness Risks in Media - Technology Org",
          "date": "Fri, 13 Mar 2026 07:00:00 GMT"
        },
        {